{
  "schema_name": "dashboard-snapshot",
  "schema_version": "1.0.0",
  "stream_sequence": "4",
  "records": [
    {
      "schema_name": "dashboard-record",
      "schema_version": "1.0.0",
      "event_id": "evt_dashboard01",
      "occurred_at": "2026-08-30T01:00:00Z",
      "capability": "context.build",
      "outcome": "limited",
      "policy_decision": "sha256:2222222222222222222222222222222222222222222222222222222222222222",
      "limits": {
        "unit_kind": "utf8_bytes",
        "requested": "12000",
        "hard": true,
        "max_evidence_items": "100",
        "max_files": "40",
        "max_excerpt_bytes_per_item": "4096",
        "max_matches": "1000",
        "max_traversal_depth": "32",
        "max_elapsed_ms": "5000",
        "max_memory_bytes": "536870912",
        "policy_profile": "sha256:aba86621046ccc86cff7aabb81f4eab1020ab6db53ae1b649ea3977dec9649e8"
      },
      "duration_ms": "17",
      "engine_version": "0.1.0",
      "workspace_identity_present": true,
      "snapshot_identity_present": true,
      "workspace_label": "sha256:3333333333333333333333333333333333333333333333333333333333333333"
    }
  ],
  "aggregates": [
    {"capability": "context.build", "outcome": "limited", "events": "1", "duration_ms": "17"}
  ],
  "unavailable_rows": "2"
}
